{
  "$schema": "./foundations.schema.json",
  "meta": {
    "source": "Figma PRD — Copy",
    "fileKey": "2uayhHpYDyrue0XL4o2Zwt",
    "policy": "Published role tokens alias Core values. Product components consume published roles only."
  },
  "spacing": [
    { "name": "Scale/Space 00", "css": "--space-00", "value": 0, "alias": "Core/Spacing/Space00", "description": "Reset gaps and padding only." },
    { "name": "Scale/Space 02", "css": "--space-02", "value": 2, "alias": "Core/Spacing/Space02", "description": "Micro separation and focus-ring offset." },
    { "name": "Scale/Space 04", "css": "--space-04", "value": 4, "alias": "Core/Spacing/Space04", "description": "Tight internal separation." },
    { "name": "Scale/Space 06", "css": "--space-06", "value": 6, "alias": "Core/Spacing/Space06", "description": "Compact label and icon gaps." },
    { "name": "Scale/Space 08", "css": "--space-08", "value": 8, "alias": "Core/Spacing/Space08", "description": "Default compact component gap." },
    { "name": "Scale/Space 10", "css": "--space-10", "value": 10, "alias": "Core/Spacing/Space10", "description": "Status and dense-control padding." },
    { "name": "Scale/Space 12", "css": "--space-12", "value": 12, "alias": "Core/Spacing/Space12", "description": "Standard control padding." },
    { "name": "Scale/Space 14", "css": "--space-14", "value": 14, "alias": "Core/Spacing/Space14", "description": "Compact cell padding." },
    { "name": "Scale/Space 16", "css": "--space-16", "value": 16, "alias": "Core/Spacing/Space16", "description": "Default container padding." },
    { "name": "Scale/Space 18", "css": "--space-18", "value": 18, "alias": "Core/Spacing/Space18", "description": "Approved filled page-action padding." },
    { "name": "Scale/Space 20", "css": "--space-20", "value": 20, "alias": "Core/Spacing/Space20", "description": "Comfortable component spacing." },
    { "name": "Scale/Space 24", "css": "--space-24", "value": 24, "alias": "Core/Spacing/Space24", "description": "Default section and grid gap." },
    { "name": "Scale/Space 28", "css": "--space-28", "value": 28, "alias": "Core/Spacing/Space28", "description": "Large component separation." },
    { "name": "Scale/Space 30", "css": "--space-30", "value": 30, "alias": "Core/Spacing/Space30", "description": "Special layout alignment step." },
    { "name": "Scale/Space 32", "css": "--space-32", "value": 32, "alias": "Core/Spacing/Space32", "description": "Large section padding." },
    { "name": "Scale/Space 40", "css": "--space-40", "value": 40, "alias": "Core/Spacing/Space40", "description": "Major content-group separation." },
    { "name": "Scale/Space 48", "css": "--space-48", "value": 48, "alias": "Core/Spacing/Space48", "description": "Page-region separation." },
    { "name": "Scale/Space 56", "css": "--space-56", "value": 56, "alias": "Core/Spacing/Space56", "description": "Large page rhythm." },
    { "name": "Scale/Space 64", "css": "--space-64", "value": 64, "alias": "Core/Spacing/Space64", "description": "Page top and major region spacing." },
    { "name": "Scale/Space 80", "css": "--space-80", "value": 80, "alias": "Core/Spacing/Space80", "description": "Maximum section separation." },
    { "name": "Component/Button Inline Gap", "css": "--spacing-component-button-inline-gap", "value": 7, "alias": "Core/Number/07", "description": "Space between a button icon and label." },
    { "name": "Component/Summary Cell Vertical Padding", "css": "--summary-cell-padding-y", "value": 17, "alias": "Core/Sizing/Size17", "description": "Vertical padding for summary-panel cells." }
  ],
  "radius": [
    { "name": "Scale/Radius None", "css": "--radius-radius-none", "value": 0, "alias": "Core/Radius/Radius00", "description": "Dividers and deliberately square geometry." },
    { "name": "Scale/Radius XS", "css": "--radius-radius-xs", "value": 6, "alias": "Core/Radius/Radius06", "description": "Checkboxes and compact geometry." },
    { "name": "Scale/Radius S", "css": "--radius-radius-s", "value": 8, "alias": "Core/Radius/Radius08", "description": "Compact operational controls." },
    { "name": "Scale/Radius M", "css": "--radius-radius-m", "value": 10, "alias": "Core/Radius/Radius10", "description": "Standard fields and buttons." },
    { "name": "Scale/Radius L", "css": "--radius-radius-l", "value": 12, "alias": "Core/Radius/Radius12", "description": "Cards and grouped content." },
    { "name": "Scale/Radius XL", "css": "--radius-radius-xl", "value": 16, "alias": "Core/Radius/Radius16", "description": "Tables and summary panels." },
    { "name": "Scale/Radius XXL", "css": "--radius-radius-xxl", "value": 20, "alias": "Core/Radius/Radius20", "description": "Modals and drawers." },
    { "name": "Scale/Radius Full Round", "css": "--radius-radius-full-round", "value": 999, "alias": "Core/Radius/Radius99", "description": "Statuses, avatars and circular controls only." },
    { "name": "Component/Checkbox", "css": "--radius-component-checkbox", "value": 6, "alias": "Scale/Radius XS", "description": "Checkbox and radio geometry." },
    { "name": "Component/Compact Control", "css": "--radius-component-compact-control", "value": 8, "alias": "Scale/Radius S", "description": "Dense table and row actions." },
    { "name": "Component/Field & Button", "css": "--radius-component-field-and-button", "value": 10, "alias": "Scale/Radius M", "description": "Standard fields, selects and page buttons." },
    { "name": "Component/Card", "css": "--radius-component-card", "value": 12, "alias": "Scale/Radius L", "description": "Service and grouped-content cards." },
    { "name": "Component/Panel & Table", "css": "--radius-component-panel-and-table", "value": 16, "alias": "Scale/Radius XL", "description": "Primary panels and table shells." },
    { "name": "Component/Modal & Drawer", "css": "--radius-component-modal-and-drawer", "value": 20, "alias": "Scale/Radius XXL", "description": "Modal and drawer containers." },
    { "name": "Component/Status", "css": "--radius-component-status", "value": 999, "alias": "Scale/Radius Full Round", "description": "Semantic status badges." },
    { "name": "Component/Avatar", "css": "--radius-component-avatar", "value": 999, "alias": "Scale/Radius Full Round", "description": "Avatars and circular icon controls." },
    { "name": "Component/Count Badge", "css": "--radius-count-badge", "value": 5, "alias": "Core/Radius/Radius05", "description": "Compact count and navigation badges." },
    { "name": "Focus/Checkbox", "css": "--radius-focus-checkbox", "value": 8, "alias": "Core/Radius/Radius08", "description": "Checkbox radius plus focus offset." },
    { "name": "Focus/Compact Control", "css": "--radius-focus-compact-control", "value": 10, "alias": "Core/Radius/Radius10", "description": "Compact-control radius plus focus offset." },
    { "name": "Focus/Field & Button", "css": "--radius-focus-field-and-button", "value": 12, "alias": "Core/Radius/Radius12", "description": "Field and button radius plus focus offset." },
    { "name": "Focus/Card", "css": "--radius-focus-card", "value": 14, "alias": "Core/Radius/Radius14", "description": "Card radius plus focus offset." },
    { "name": "Focus/Panel & Table", "css": "--radius-focus-panel-and-table", "value": 18, "alias": "Core/Radius/Radius18", "description": "Panel radius plus focus offset." },
    { "name": "Focus/Modal & Drawer", "css": "--radius-focus-modal-and-drawer", "value": 22, "alias": "Core/Radius/Radius22", "description": "Modal radius plus focus offset." }
  ],
  "sizing": [
    { "name": "Control/XS", "css": "--size-control-xs", "value": 32, "alias": "Core/Sizing/Size32", "description": "Dense utilities with a surrounding accessible hit area." },
    { "name": "Control/Compact", "css": "--size-control-compact", "value": 34, "alias": "Core/Sizing/Size34", "description": "Data-table row actions." },
    { "name": "Control/Standard", "css": "--size-control-standard", "value": 40, "alias": "Core/Sizing/Size40", "description": "Default buttons, fields, selects and toolbar controls." },
    { "name": "Control/Large", "css": "--size-control-large", "value": 44, "alias": "Core/Sizing/Size44", "description": "High-priority actions and accessible large controls." },
    { "name": "Status/Height", "css": "--size-status-height", "value": 26, "alias": "Core/Sizing/Size26", "description": "Semantic status-badge height." },
    { "name": "Status/Dot", "css": "--size-status-dot", "value": 6, "alias": "Core/Sizing/Size06", "description": "Semantic status-indicator dot." },
    { "name": "Checkbox/Size", "css": "--size-checkbox-size", "value": 20, "alias": "Core/Sizing/Size20", "description": "Visible checkbox and radio size." },
    { "name": "Pagination/Control", "css": "--size-pagination-control", "value": 32, "alias": "Core/Sizing/Size32", "description": "Pagination arrow and page controls." },
    { "name": "Icon/S", "css": "--size-icon-s", "value": 12, "alias": "Core/Sizing/Size12", "description": "Status dots and compact supporting icons." },
    { "name": "Icon/M", "css": "--size-icon-m", "value": 16, "alias": "Core/Sizing/Size16", "description": "Default buttons, inputs, table actions and navigation icons." },
    { "name": "Icon/L", "css": "--size-icon-l", "value": 20, "alias": "Core/Sizing/Size20", "description": "Prominent utilities and navigation icons." },
    { "name": "Icon/XL", "css": "--size-icon-xl", "value": 24, "alias": "Core/Sizing/Size24", "description": "Empty-state and section-leading icons." },
    { "name": "Avatar/S", "css": "--size-avatar-s", "value": 24, "alias": "Core/Sizing/Size24", "description": "Compact inline avatars." },
    { "name": "Avatar/M", "css": "--size-avatar-m", "value": 32, "alias": "Core/Sizing/Size32", "description": "Default identity avatars." },
    { "name": "Avatar/L", "css": "--size-avatar-l", "value": 40, "alias": "Core/Sizing/Size40", "description": "Prominent identity avatars." },